{
  "benchmarkRelease" : {
    "id" : "suite-b-power",
    "version" : "1.1.0"
  },
  "conflictOfInterest" : {
    "category" : "none",
    "statement" : "No conflict of interest disclosed."
  },
  "contributor" : {
    "githubHandle" : "Sunnyone1234"
  },
  "createdAt" : "2026-07-22T21:38:27Z",
  "declarations" : {
    "acceptsCCBY40" : true,
    "authorizedToSubmit" : true,
    "containsNoPersonalData" : true,
    "ranOnPhysicalDevice" : true,
    "rawResultUnmodified" : true,
    "reviewedPublicMetadata" : true,
    "understandsNoRankingGuarantee" : true
  },
  "environmentalDisclosure" : {
    "thermalAssistance" : "none"
  },
  "requestedEvidenceLevel" : "community-submitted",
  "result" : {
    "artifactID" : "mlx-community/Qwen3-0.6B-4bit",
    "artifactRevision" : "73e3e38d981303bc594367cd910ea6eb48349da8",
    "machineIdentifier" : "iPhone15,3",
    "path" : "result.json",
    "resultID" : "786A779A-3220-4AD3-8975-EAF2213D0183",
    "runtimeName" : "MLX Swift LM",
    "runtimeVersion" : "3.31.4",
    "schemaVersion" : "suite-b-power-result-1.1.0-rc.1",
    "sha256" : "74d0bb7a715faab49a4cfd3d03f139eef529666f0fe6fcd20ab6601b5f16cee2",
    "workloadID" : "b-ux-001-short-interaction"
  },
  "schemaVersion" : "suite-b-power-submission-1.1.0",
  "state" : "draft",
  "submissionID" : "311d6747-c83c-4406-83ae-9873a20c17ca"
}
